_id,id_Autor,titulo,descripcion,preguntas[0].id,preguntas[1].id,preguntas[2].id,preguntas[0].texto,preguntas[1].texto,preguntas[2].texto,preguntas[0].tipo,preguntas[1].tipo,preguntas[2].tipo,preguntas[0].opciones,preguntas[1].opciones,preguntas[2].opciones,createdAt,updatedAt,__v
64c46d67c3c345b564593b52,64c454d32f5ebe20cb72c343,Mi primer formulario,Esto es la descripcion de mi primer formulario,1,2,3,¿De que color es el cielo?,¿Que pasa si me pica una araña?,¿Como estas?,,,,,,,2023-07-29T01:37:43.226Z,2023-07-29T01:37:43.226Z,0
64c47158a21a84360f0cb70b,64c454d32f5ebe20cb72c343,Internet en tus manos,Encuesta para saber tu conocimiento en redes,4,5,6,Sabes hacer un conector RJ45?,Sabes como funciona una antena?,Sabes como funciona la fibra?,,,,,,,2023-07-29T01:54:32.186Z,2023-07-29T01:54:32.186Z,0
64c471c3a21a84360f0cb718,64c4552f2f5ebe20cb72c347,El mundo del FIFA,Formulario para saber tus conocimientos en el futbol,7,8,9,¿Quien es el maximo goleador del mundo?,¿Messi o Ronaldo?,Que equipo tiene mas Champions?,,,,,,,2023-07-29T01:56:19.527Z,2023-07-29T01:56:19.527Z,0
64c4720fa21a84360f0cb725,64c455b32f5ebe20cb72c349,Programacion,Formulario para pruebas,10,11,12,Que sabes de programacion?,Que lenguaje de programacion manejas?,Te gusta la programacion web?,,,,,,,2023-07-29T01:57:35.147Z,2023-07-29T01:57:35.147Z,0
64c47302a21a84360f0cb7a8,64c454f82f5ebe20cb72c345,Los mejores juegos,Formulario para saber tu experiencia en juegos,13,14,15,Cual es tu videojuego fav?,En que juego tienes mas horas?,Que videojuego odias?,,,,,,,2023-07-29T02:01:38.428Z,2023-07-29T02:01:38.428Z,0
